### ISSUE TITLE
Intermittent RADIUS Failures for Ruckus AP - Requests Arrive but No Response

### ISSUE THREAD

**Issue by rqi14** [inverse-inc/packetfence#8657]
**Describe the bug**
We are experiencing intermittent RADIUS authentication failures for clients connecting through a Ruckus Unleashed AP (R310). The PacketFence RADIUS service sometimes fails to respond to authentication requests from the AP. At the time of failure, there is no any record of the requests in packetfence.log or radius.log. Importantly, tcpdump on the PacketFence host confirms that the RADIUS request packets from the AP are arriving at the server even during these failure instances.

When the RADIUS server is not responding to my AP, it does not respond to other clients either. But it responds to radtest from localhost.

Tcpdump when not responding
```
15:09:31.363691 eth1  In  IP 192.168.5.10.49097 > 192.168.5.4.1812: RADIUS, Access-Request (1), id: 0x82 length: 245
15:09:37.462895 eth1  In  IP 192.168.5.10.49097 > 192.168.5.4.1812: RADIUS, Access-Request (1), id: 0x82 length: 245
15:09:49.157812 eth1  In  IP 192.168.5.10.49097 > 192.168.5.4.1812: RADIUS, Access-Request (1), id: 0x83 length: 245
15:09:52.163060 eth1  In  IP 192.168.5.10.49097 > 192.168.5.4.1812: RADIUS, Access-Request (1), id: 0x83 length: 245
15:09:58.264044 eth1  In  IP 192.168.5.10.49097 > 192.168.5.4.1812: RADIUS, Access-Request (1), id: 0x83 length: 245
15:10:07.190389 eth1  In  IP 192.168.5.10.49097 > 192.168.5.4.1812: RADIUS, Access-Request (1), id: 0x84 length: 245
15:10:10.264425 eth1  In  IP 192.168.5.10.49097 > 192.168.5.4.1812: RADIUS, Access-Request (1), id: 0x84 length: 245
15:10:16.364193 eth1  In  IP 192.168.5.10.49097 > 192.168.5.4.1812: RADIUS, Access-Request (1), id: 0x84 length: 245
15:59:43.546450 eth0  In  IP 192.168.5.10.49097 > 192.168.5.4.1812: RADIUS, Access-Request (1), id: 0x85 length: 245
```

When responding
```
15:59:43.546450 eth0  In  IP 192.168.5.10.49097 > 192.168.5.4.1812: RADIUS, Access-Request (1), id: 0x85 length: 245
15:59:43.555423 eth0  Out IP 192.168.5.4.1812 > 192.168.5.10.49097: RADIUS, Access-Challenge (11), id: 0x85 length: 64
15:59:43.572593 eth0  In  IP 192.168.5.10.49097 > 192.168.5.4.1812: RADIUS, Access-Request (1), id: 0x86 length: 680
15:59:43.578048 eth0  Out IP 192.168.5.4.1812 > 192.168.5.10.49097: RADIUS, Access-Challenge (11), id: 0x86 length: 1086
15:59:43.586667 eth0  In  IP 192.168.5.10.49097 > 192.168.5.4.1812: RADIUS, Access-Request (1), id: 0x87 length: 247
15:59:43.587449 eth0  Out IP 192.168.5.4.1812 > 192.168.5.10.49097: RADIUS, Access-Challenge (11), id: 0x87 length: 1086
15:59:43.595309 eth0  In  IP 192.168.5.10.49097 > 192.168.5.4.1812: RADIUS, Access-Request (1), id: 0x88 length: 247
15:59:43.596051 eth0  Out IP 192.168.5.4.1812 > 192.168.5.10.49097: RADIUS, Access-Challenge (11), id: 0x88 length: 1086
15:59:43.603413 eth0  In  IP 192.168.5.10.49097 > 192.168.5.4.1812: RADIUS, Access-Request (1), id: 0x89 length: 247
15:59:43.604302 eth0  Out IP 192.168.5.4.1812 > 192.168.5.10.49097: RADIUS, Access-Challenge (11), id: 0x89 length: 219
15:59:43.638498 eth0  In  IP 192.168.5.10.49097 > 192.168.5.4.1812: RADIUS, Access-Request (1), id: 0x8a length: 1472
15:59:43.639463 eth0  Out IP 192.168.5.4.1812 > 192.168.5.10.49097: RADIUS, Access-Challenge (11), id: 0x8a length: 64
15:59:43.646553 eth0  In  IP 192.168.5.10.49097 > 192.168.5.4.1812: RADIUS, Access-Request (1), id: 0x8b length: 918
15:59:43.697397 eth0  Out IP 192.168.5.4.1812 > 192.168.5.10.49097: RADIUS, Access-Challenge (11), id: 0x8b length: 119
15:59:43.705590 eth0  In  IP 192.168.5.10.49097 > 192.168.5.4.1812: RADIUS, Access-Request (1), id: 0x8c length: 247
15:59:43.865357 eth0  Out IP 192.168.5.4.1812 > 192.168.5.10.49097: RADIUS, Access-Accept (2), id: 0x8c length: 179
15:59:43.899670 eth0  In  IP 192.168.5.10.59446 > 192.168.5.4.1813: RADIUS, Accounting-Request (4), id: 0x8d length: 258
15:59:43.900343 docker0 Out IP 100.64.0.1.53012 > 100.64.0.7.1813: RADIUS, Accounting-Request (4), id: 0x8d length: 258
15:59:43.900352 veth63dae10 Out IP 100.64.0.1.53012 > 100.64.0.7.1813: RADIUS, Accounting-Request (4), id: 0x8d length: 258
15:59:43.900357 vethc18dbcf Out IP 100.64.0.1.53012 > 100.64.0.7.1813: RADIUS, Accounting-Request (4), id: 0x8d length: 258
15:59:43.900360 vethdc0c786 Out IP 100.64.0.1.53012 > 100.64.0.7.1813: RADIUS, Accounting-Request (4), id: 0x8d length: 258
15:59:43.900363 vetha8a1101 Out IP 100.64.0.1.53012 > 100.64.0.7.1813: RADIUS, Accounting-Request (4), id: 0x8d length: 258
15:59:43.900368 vethf618731 Out IP 100.64.0.1.53012 > 100.64.0.7.1813: RADIUS, Accounting-Request (4), id: 0x8d length: 258
15:59:43.900372 vetha046121 Out IP 100.64.0.1.53012 > 100.64.0.7.1813: RADIUS, Accounting-Request (4), id: 0x8d length: 258
15:59:43.900375 veth950a03e Out IP 100.64.0.1.53012 > 100.64.0.7.1813: RADIUS, Accounting-Request (4), id: 0x8d length: 258
15:59:43.900379 vethb9f492b Out IP 100.64.0.1.53012 > 100.64.0.7.1813: RADIUS, Accounting-Request (4), id: 0x8d length: 258
15:59:43.900390 veth22df338 Out IP 100.64.0.1.53012 > 100.64.0.7.1813: RADIUS, Accounting-Request (4), id: 0x8d length: 258
15:59:43.900395 vethef39c40 Out IP 100.64.0.1.53012 > 100.64.0.7.1813: RADIUS, Accounting-Request (4), id: 0x8d length: 258
15:59:43.900399 veth68b7f0c Out IP 100.64.0.1.53012 > 100.64.0.7.1813: RADIUS, Accounting-Request (4), id: 0x8d length: 258
15:59:43.900403 vethb0b2059 Out IP 100.64.0.1.53012 > 100.64.0.7.1813: RADIUS, Accounting-Request (4), id: 0x8d length: 258
15:59:43.900406 veth65deaa9 Out IP 100.64.0.1.53012 > 100.64.0.7.1813: RADIUS, Accounting-Request (4), id: 0x8d length: 258
15:59:43.903403 vethb9f492b P   IP 100.64.0.7.1813 > 100.64.0.1.53012: RADIUS, Accounting-Response (5), id: 0x8d length: 35
15:59:43.903413 docker0 In  IP 100.64.0.7.1813 > 100.64.0.1.53012: RADIUS, Accounting-Response (5), id: 0x8d length: 35
15:59:43.903524 eth0  Out IP 192.168.5.4.1813 > 192.168.5.10.59446: RADIUS, Accounting-Response (5), id: 0x8d length: 35

```

**To Reproduce**
1. Clients attempt to connect to a WLAN SSID on a Ruckus AP, which is configured to use PacketFence for RADIUS authentication (802.1x EAP-TLS).
2. Monitor RADIUS requests from the AP's IP address on the PacketFence host using tcpdump (e.g., tcpdump -i any host <AP_IP_ADDRESS> and port 1812).
3. Observe client connection attempts.

**Screenshots**
N/A

**Expected behavior**
The packetfence server should always respond to the RADIUS requests. 
The requests should be recorded in the logs.

**Desktop (please complete the following information):**
 - OS: Windows
 - Version 11

**Additional context**
The server is running ZEN image (14.1.0).
`radtest` was run locally on the packetfence server and on another computer, and both work fine.

**Comment by fdurand** [comment]
When it happens, can you run raddebug ?

```
raddebug -f /usr/local/pf/var/run/radiusd.sock -t 0
```

**Comment by rqi14** [comment]
> When it happens, can you run raddebug ?
> 
> ```
> raddebug -f /usr/local/pf/var/run/radiusd.sock -t 0
> ```

Please check the attachment.

[raddebug.txt](https://github.com/user-attachments/files/20499071/raddebug.txt)

An interesting thing I found with tcpdump is that when the failure happens the RADIUS packets are sent to eth1, while at normal times it was sent to eth0. 
eth0 is my management interface and eth1 is portal and registration.
I'm sure the AP has been set to use the IP address of eth0 as the RADIUS server IP. 
When I do `radtest`, either localhost or the eth0's IP is set. 
The IP of eth1 is never used in any test.

Both eth0 and eth1 are virtual NICs created with the same bridge of the host

![Image](https://github.com/user-attachments/assets/1d6fc024-4c37-4bc5-b0cc-eeb1d0bfbe59)

**Comment by rqi14** [comment]
I confirmed this was an ARP misbehaving issue origined from using 2 virtual NICs with the same physical NIC in a virtual machine.

It can be fixed by adding the following settings in `sysctl`

```
net.ipv4.conf.all.arp_ignore = 1
net.ipv4.conf.default.arp_ignore = 1
net.ipv4.conf.eth0.arp_ignore = 1
net.ipv4.conf.eth1.arp_ignore = 1

net.ipv4.conf.all.arp_filter = 1
net.ipv4.conf.default.arp_filter = 1
net.ipv4.conf.eth0.arp_filter = 1
net.ipv4.conf.eth1.arp_filter = 1
```
