### ISSUE TITLE
pfdns doesn't return IP address of portal

### ISSUE THREAD

**Issue by nqb** [inverse-inc/packetfence#5885]
**Describe the bug**
In a inline L2 setup, I'm not able to get IP address of portal when I query `pfdns`.

It looks like `pfdns` forwards request for name of portal to DNS configured for inline L2 network in place of answering itself.

**To Reproduce**
1. Configure an inline L2 network with DHCP and a DNS server
2. Restart haproxy-portal, pfdns, iptables, pfdhcp, pfdhcplistener services
3. Get an IP address on L2 network

Try to reach a website, you got an error when you're redirected to https://NAME_OF_PORTAL/

A DNS query from inline L2 network return a NXDOMAIN.

**Expected behavior**
`pfdns` should return IP address of portal or 66.70.255.147

**Additional context**
DNS queries captured on my PF server with 172.17.6.0/24 my inline L2 network and 192.168.121.0/24 network attached to Internet: 
```
08:31:58.448278 IP 172.17.6.137.44393 > 172.17.6.2.53: 12017+ A? portail.example.lan. (37)
08:31:58.448904 IP 172.17.6.137.44393 > 172.17.6.2.53: 63499+ AAAA? portail.example.lan. (37)
08:31:58.459370 IP 192.168.121.100.35317 > 192.168.121.1.53: 63499+ AAAA? portail.example.lan. (37)
08:31:58.459694 IP 192.168.121.100.43763 > 192.168.121.1.53: 12017+ A? portail.example.lan. (37)
08:31:58.459933 IP 192.168.121.1.53 > 192.168.121.100.35317: 63499 NXDomain 0/0/0 (37)
08:31:58.459987 IP 192.168.121.1.53 > 192.168.121.100.43763: 12017 0/0/0 (37)
```

networks.conf
```
[172.17.6.0]
coa=disabled
gateway=172.17.6.2
named=enabled
pool_backend=memory
split_network=disabled
dhcp_end=172.17.6.246
dns=192.168.121.1
type=inlinel2
dhcp_start=172.17.6.10
fake_mac_enabled=disabled
dhcp_default_lease_time=86400
netflow_accounting_enabled=enabled
dhcp_max_lease_time=86400
nat_enabled=enabled
netmask=255.255.255.0
dhcpd=enabled
domain-name=inlinel2.example.lan
id=172.17.6.0
```

**Comment by nqb** [comment]
Same behavior with a registration interface.

**Comment by fdurand** [comment]
I have a the latest devel installed and i am not able to replicate. (inline and reg network).
It will be easier if i have access to the machine.

**Comment by julsemaan** [comment]
Useful for the maintenance ?
