### ISSUE TITLE
PFConnector Remote Not Passing on Radius Requests.

### ISSUE THREAD

**Issue by PureOxygen-Dev** [inverse-inc/packetfence#7235]
**Describe the bug**
pfconnector remote is not give back a response to the NAS 

**To Reproduce**
Steps to reproduce the behaviour:
1. Configure Cisco WLC to communicate directly to PF using EAP-TLS
2. Connect node via EAP TLS successfully confirming PF and NAS configuration
3. Configure pfconnector as per documentation
4. Point Cisco WLC at pfconnector remote IP

5. See Traffic arrive from NAS 
16:03:22.615024 IP 10.7.239.241.32775 > 10.203.1.6.1812: RADIUS, Access-Request (1), id: 0x7f length: 299

6. See traffic from pfconnector towards PF
16:03:22.615150 IP 10.203.1.6.37102 > 10.202.1.31.1443: Flags [P.], seq 1992:2394, ack 557, win 501, options [nop,nop,TS val 935933245 ecr 2747438252], length 402
16:03:22.627527 IP 10.202.1.31.1443 > 10.203.1.6.37102: Flags [.], ack 2394, win 501, options [nop,nop,TS val 2747446153 ecr 935933245], length 0
16:03:22.627891 IP 10.202.1.31.1443 > 10.203.1.6.37102: Flags [P.], seq 557:617, ack 2394, win 501, options [nop,nop,TS val 2747446154 ecr 935933245], length 60
16:03:22.669886 IP 10.203.1.6.37102 > 10.202.1.31.1443: Flags [.], ack 617, win 501, options [nop,nop,TS val 935933300 ecr 2747446154], length 0

No traffic returns to WLC from pfconnector nor is there any activity in the Radius logging using 

raddebug -f /usr/local/pf/var/run/radiusd.sock -t 3000

**Expected behavior**
Response back to WLC in the same way as PF does.

**Additional context**
Due to lack of logging available impossible to trouble shoot further?

**Comment by julsemaan** [comment]
Check the radius.log file. It could be invalid secret/unknown client

You can tcpdump on port 1812 on the PF server, the traffic will exit the pfconnector-server and be sent on port 1812 in plain RADIUS

**Comment by PureOxygen-Dev** [comment]
Hi Julsemaan

Nothing coming out on port 1812 on the PF server and nothing in the radius.log.

There is def chit chat between the PF Server and the pfconnector remote.  So were a little stuck.  We might on Monday raise a support ticket it we don't figure it out ourselves this weekend.

**Comment by PureOxygen-Dev** [comment]
Confirmed the issue and raised in more specific issues.
